OBJECTID,CODUOME,NIF,NOME,TIPOAGRUPAMENTO,MORADA,LOCALIDADE,CONCELHO,DISTRITO,CODESCOLAMESEDE,CODDSR,CODQZP,GRUPONATUREZAINST,NUM_ESCOLAS,FAX,URL,EMAIL,TELEFONE,x,y
13980,160532,600077012,Agrupamento de Escolas de Vouzela,Agrupada,Bairro da Senra,VOUZELA,Vouzela,Viseu,310414,Centro,QZP.21,Publico,5,232772053,WWW.aevouzela.net,direcao@aevouzela.edu.gov.pt;servicos@aevouzela.edu.gov.pt,232772046;232771395,1622.33330621132,117132.218095314
13981,160854,600080854,"Agrupamento de Escolas Padre José Augusto da Fonseca, Aguiar da Beira",Agrupada,Bairro Padre José Augusto da Fonseca,AGUIAR DA BEIRA,Aguiar da Beira,Guarda,346380,Centro,QZP.32,Publico,7,232689039,"Rua Frei Joaquim Santa Rosa Viterbo, nº.2 Aguiar da Beira 3570-077 Aguiar da Beira",direcao@agb.edu.gov.pt;servicos@agb.edu.gov.pt,232689030;232689033,50109.321138902,128286.302864266
13982,160581,600081338,Agrupamento de Escolas de Vila de Rei,Agrupada,Av. José Cardoso Pires,VILA DE REI,Vila de Rei,Castelo Branco,330036,Centro,QZP.35,Publico,2,274898340,,direcao@aevr.edu.gov.pt;servicos@aevr.edu.gov.pt,274890050;274890053,-888.488629804481,1490.23745865852
13983,160489,600077837,"Agrupamento de Escolas Padre António de Andrade, Oleiros",Agrupada,"Rua dos Bombeiros Voluntários, nº 12",OLEIROS,Oleiros,Castelo Branco,345970,Centro,QZP.35,Publico,4,272682770,,direcao@aepaa.edu.gov.pt;servicos@aepaa.edu.gov.pt,272680210,18855.0019388112,28103.6898395237
13984,160763,600075087,Agrupamento de Escolas José Sanches e S. Vicente da Beira,Agrupada,Rua José Sanches Roque,ALCAINS,Castelo Branco,Castelo Branco,403660,Centro,QZP.36,Publico,11,272900277,www.agrup-alcains-svb.com,direcao@agrup-alcains-svb.edu.gov.pt;servicos@agrup-alcains-svb.edu.gov.pt,272900270;272900271,56978.6456377212,27125.4822397726
13985,160787,600075753,Agrupamento de Escolas de Vila Velha de Ródão,Agrupada,Rua da Escola,VILA VELHA DE RÓDÃO,Vila Velha de Ródão,Castelo Branco,345064,Centro,QZP.36,Publico,2,272541050,www.aevvr.pt,direcao@aevvr.edu.gov.pt;servicos@aevvr.edu.gov.pt,272541041;272541052,39140.2730583752,-1392.29004582115
13986,160799,600079287,Agrupamento de Escolas de Proença-a-Nova,Agrupada,Av. do Colégio,PROENÇA-A-NOVA,Proença-a-Nova,Castelo Branco,346100,Centro,QZP.35,Publico,3,274671819,www.aeproencaanova.pt,direcao@aepnova.edu.gov.pt;servicos@aepnova.edu.gov.pt,274670080,17965.7859809409,9299.90087920017
13987,160805,600077420,"Agrupamento de Escolas José Silvestre Ribeiro, Idanha-a-Nova",Agrupada,Rua Doutor Aprígio Melo Leão de Meireles,IDANHA-A-NOVA,Idanha-a-Nova,Castelo Branco,345880,Centro,QZP.36,Publico,9,277202400,,direcao@agrupamentoidanha.edu.gov.pt;servicos@agrupamentoidanha.edu.gov.pt,277200260,76232.2381451347,29363.0115667999
13988,161111,600075222,"Agrupamento de Escolas Afonso de Paiva, Castelo Branco",Agrupada,R. Dr. Francisco Jose Palmeiro,CASTELO BRANCO,Castelo Branco,Castelo Branco,340029,Centro,QZP.36,Publico,7,272339249,afonsopaiva.pt,direcao@aeapaiva.edu.gov.pt;servicos@aeapaiva.edu.gov.pt,272339240,54021.4722813314,17060.4165543741
13989,161135,600075567,"Agrupamento de Escolas Amato Lusitano, Castelo Branco",Agrupada,Avenida Pedro Álvares Cabral,CASTELO BRANCO,Castelo Branco,Castelo Branco,400830,Centro,QZP.36,Publico,5,272329776,www.aeamatolusitano.edu.pt,direcao@aeamatolusitano.edu.gov.pt;servicos@aeamatolusitano.edu.gov.pt,272339280,54392.2096787093,17145.1831963314
13990,161214,600077314,"Agrupamento de Escolas Ribeiro Sanches, Penamacor",Agrupada,Sítio do Areal - Apartado 29,PENAMACOR,Penamacor,Castelo Branco,342956,Centro,QZP.34,Publico,2,277390091,,direcao@ribeirosanches.edu.gov.pt;servicos@ribeirosanches.edu.gov.pt,277390090;277390093,81546.8522090301,55654.4312077027
13991,161226,600075281,Agrupamento de Escolas de Sertã,Agrupada,Avenida Prof. Dr. David Lopes,SERTÃ,Sertã,Castelo Branco,400658,Centro,QZP.35,Publico,13,274600653,http://aes.ccems.pt/,direcao@aeserta.edu.gov.pt;servicos@aeserta.edu.gov.pt,274600650;274600651,3280.76580964753,14955.2361178368
13992,162024,600075559,"Agrupamento de Escolas Nuno Álvares, Castelo Branco",Agrupada,Avenida Nuno Álvares,CASTELO BRANCO,Castelo Branco,Castelo Branco,402321,Centro,QZP.36,Publico,8,272320240,www.aenacb.pt,direcao@aenacb.edu.gov.pt;servicos@aenacb.edu.gov.pt,272340550;272339470,54832.1726748978,17284.2557563608
13993,172479,600085317,"Agrupamento de Escolas Templários, Tomar",Agrupada,Avenida D. Maria II,TOMAR,Tomar,Santarém,400270,Lisboa e Vale do Tejo,QZP.37,Publico,14,249323065,http://www.aet.pt,direcao@aetemplarios.edu.gov.pt;servicos@aetemplarios.edu.gov.pt,249310050,-23358.3851885662,-7430.30758970787
13994,171207,600085074,"Agrupamento de Escolas Nuno de Santa Maria, Tomar",Agrupada,Alameda dos Templários,TOMAR,Tomar,Santarém,402734,Lisboa e Vale do Tejo,QZP.37,Publico,10,249323055,,direcao@aensm.edu.gov.pt;servicos@aensm.edu.gov.pt,249328360;249313595,-23263.4490903865,-7221.52808304278
13995,120960,600082881,Agrupamento de Escolas de Ourém,Agrupada,Rua Dr. António Justiniano da Luz Preto,OURÉM,Ourém,Santarém,402357,Lisboa e Vale do Tejo,QZP.37,Publico,16,249540575,,direcao@aeourem.edu.gov.pt;servicos@aeourem.edu.gov.pt,249540570;249544959,-38370.6259662556,-970.533305930543
13996,121502,600083233,Agrupamento de Escolas n.º 2 de Abrantes,Agrupada,"R. General Humberto Delgado, 1",ABRANTES,Abrantes,Santarém,401547,Lisboa e Vale do Tejo,QZP.38,Publico,7,241360881,http://www.esmf.pt/,direcao@aen2-abrantes.edu.gov.pt;servicos@aen2-abrantes.edu.gov.pt,241360880;241360883,-6324.07583866123,-23596.9728325826
13997,172340,600083578,"Agrupamento de Escolas Artur Gonçalves, Torres Novas",Agrupada,Avenida Sá Carneiro,TORRES NOVAS,Torres Novas,Santarém,400944,Lisboa e Vale do Tejo,QZP.37,Publico,5,249830695,www.agrupamento.esagtn.com,direcao@aeagtn.edu.gov.pt;servicos@aeagtn.edu.gov.pt,249830690;249830696,-35073.7670505199,-21654.2520184637
13998,172390,600077110,Agrupamento de Escolas de Alcanena,Agrupada,Av. Marques de Pombal - Apartado 58,ALCANENA,Alcanena,Santarém,403313,Lisboa e Vale do Tejo,QZP.37,Publico,17,249887399,aea.alcanena.ccems.pt,direcao@aealcanena.edu.gov.pt;servicos@aealcanena.edu.gov.pt,249887390;249887396,-45590.0947216669,-22842.1989209415
13999,160660,600077411,"Agrupamento de Escolas Verde Horizonte, Mação",Agrupada,Av. Dr. Sá Carneiro,MAÇÃO,Mação,Santarém,310372,Lisboa e Vale do Tejo,QZP.38,Publico,2,241519038,www.verdehorizonte.net,direcao@aemacao.edu.gov.pt;servicos@aemacao.edu.gov.pt,241519030;241519031,11481.4995443692,-11812.3595739573
14000,170021,600079163,"Agrupamento de Escolas de Caxarias, Ourém",Agrupada,Av. 21 de Junho,CAXARIAS,Ourém,Santarém,340662,Lisboa e Vale do Tejo,QZP.37,Publico,6,249570055,http://agrupamento.acmlp.pt,direcao@aemperdigao.edu.gov.pt;servicos@aemperdigao.edu.gov.pt,249570050,-35228.3553531435,5860.39511890998
14001,170057,600082385,"Agrupamento de Escolas Conde de Ourém, Ourém",Agrupada,"R. Comandante Joaquim da Silva, Apartado 20",OURÉM,Ourém,Santarém,342403,Lisboa e Vale do Tejo,QZP.37,Publico,6,249540789,www.escolascondeourem.edu.pt,direcao@aeco.edu.gov.pt;servicos@aeco.edu.gov.pt,249540780,-37496.5009750138,-1316.96910678388
14002,170069,600066703,Agrupamento de Escolas do Sardoal,Agrupada,Tapada da Torre,SARDOAL,Sardoal,Santarém,346111,Lisboa e Vale do Tejo,QZP.38,Publico,2,241850115,http://www.portal.escolasardoal.com/,direcao@aesardoal.edu.gov.pt;servicos@aesardoal.edu.gov.pt,241850110;241850111,-2114.53520022975,-13994.9304099184
14003,170124,600080420,Agrupamento de Escolas de Constância,Agrupada,Rua Moinho de Vento - Apartado 14,CONSTÂNCIA,Constância,Santarém,342026,Lisboa e Vale do Tejo,QZP.38,Publico,4,249730299,http://www.agrupamentoescolasconstancia.pt/,direcao@aeconstancia.edu.gov.pt;servicos@aeconstancia.edu.gov.pt,249730290;249730291,-17580.0249497188,-20737.7256155121
14004,170320,600072231,Agrupamento de Escolas n.º 1 de Abrantes,Agrupada,"R. Visconde de Abrançalha, nº 262",ABRANTES,Abrantes,Santarém,402801,Lisboa e Vale do Tejo,QZP.38,Publico,9,241360010,http://ae1abrantes.esdrsolanoabreu.pt/,direcao@ae1abrantes.edu.gov.pt;servicos@ae1abrantes.edu.gov.pt,241360000;241379061,-6364.06974761068,-22828.6516305612
14005,170392,600078280,Agrupamento de Escolas de Vila Nova da Barquinha,Agrupada,Rua D. Maria II,VILA NOVA DA BARQUINHA,Vila Nova da Barquinha,Santarém,346238,Lisboa e Vale do Tejo,QZP.37,Publico,7,249720227,http://m.aevnb.ccems.pt/,direcao@aevnbarquinha.edu.gov.pt;servicos@aevnbarquinha.edu.gov.pt,249720220,-26736.9527731349,-22934.6304045787
14006,170434,600072479,"Agrupamento de Escolas Gil Paes, Torres Novas",Agrupada,Rua 25 de Abril,TORRES NOVAS,Torres Novas,Santarém,402140,Lisboa e Vale do Tejo,QZP.37,Publico,7,249839129,,direcao@agilpaes.edu.gov.pt;servicos@agilpaes.edu.gov.pt,249839120;249819302,-34970.5911554349,-20345.75122694
14007,170525,600075729,Agrupamento de Escolas de Ferreira do Zêzere,Agrupada,Praceta Guilherme Felix Soeiro,FERREIRA DO ZÊZERE,Ferreira do Zêzere,Santarém,346251,Lisboa e Vale do Tejo,QZP.37,Publico,3,249361720,http://www.aefzezere.edu.pt/portal/,direcao@aefzezere.edu.gov.pt;servicos@aefzezere.edu.gov.pt,249360010;249360012,-13218.8998435858,2530.99684062378
14008,170586,600085988,Agrupamento de Escolas Cidade do Entroncamento,Agrupada,R. Dr. Carlos Ayala Vieira da Rocha,ENTRONCAMENTO,Entroncamento,Santarém,401640,Lisboa e Vale do Tejo,QZP.37,Publico,6,249719037,nonio.ese.ipsantarem.pt/aecentroncamento,direcao@aeentroncamento.edu.gov.pt;servicos@aeentroncamento.edu.gov.pt,249726472;249726298,-29606.4793095341,-22062.4240198621
14009,161500,600076482,Agrupamento de Escolas de Almeida,Agrupada,Lugar da Raposeira,ALMEIDA,Almeida,Guarda,345799,Centro,QZP.33,Publico,2,271574709,http://www.agrupamentodealmeida.net/portal/,direcao@aealmeida.edu.gov.pt;servicos@aealmeida.edu.gov.pt,271574112;271574588,104341.348497737,117417.895478761
14010,161512,600076571,"Agrupamento de Escolas Afonso de Albuquerque, Guarda",Agrupada,Av. Dr. Afonso Costa,GUARDA,Guarda,Guarda,400701,Centro,QZP.33,Publico,15,271221217,www.aeaag.pt,direcao@aeaalbuquerque.edu.gov.pt;servicos@aeaalbuquerque.edu.gov.pt,271223377;271211550,72697.134424932,96770.0785281682
14011,161548,600075117,Agrupamento de Escolas de Sabugal,Agrupada,Rua Joaquim Manuel Correia,SABUGAL,Sabugal,Guarda,403611,Centro,QZP.33,Publico,11,271753486,http://aesabugal.pt/portal2/,direcao@aesabugal.edu.gov.pt;servicos@aesabugal.edu.gov.pt,271753490,89131.2228075423,76752.9689559306
14012,161561,600075370,Agrupamento de Escolas de Trancoso,Agrupada,Rua Drº Mota Pinto,TRANCOSO,Trancoso,Guarda,402928,Centro,QZP.31,Publico,7,271811804,http://anesbandarra.net/,direcao@aetrancoso.edu.gov.pt;servicos@aetrancoso.edu.gov.pt,271811176;271812294,65650.2558443569,122920.253070668
14013,161585,600075460,Agrupamento de Escolas de Pinhel,Agrupada,Avenida Carneiro de Gusmão,PINHEL,Pinhel,Guarda,403623,Centro,QZP.31,Publico,4,271413387,portal.aepinhel.org,direcao@aepinhel.edu.gov.pt;servicos@aepinhel.edu.gov.pt,271413396;271413933,89373.1659261829,123261.383380893
14014,161597,600075494,Agrupamento de Escolas de Gouveia,Agrupada,R. Vergílio Ferreira,GOUVEIA,Gouveia,Guarda,401870,Centro,QZP.32,Publico,10,238494200,www.esgouveia.pt,direcao@aegouveia.edu.gov.pt;servicos@aegouveia.edu.gov.pt,238491018;238498148,45576.1585532155,91419.6253657924
14015,161925,600084388,Agrupamento de Escolas de Seia,Agrupada,R. Alexandre Herculano,SEIA,Seia,Guarda,400543,Centro,QZP.32,Publico,5,238317416,http://www.aeseia.pt,direcao@aeseia.edu.gov.pt;servicos@aeseia.edu.gov.pt,238315717;238317414,36036.3539316466,82502.4235328714
14016,161937,600084051,"Agrupamento de Escolas Dr. Guilherme Correia de Carvalho, Seia",Agrupada,Rua Gaspar Rebelo,SEIA,Seia,Guarda,344758,Centro,QZP.32,Publico,4,238310161,www.aegcc.com,direcao@aegcc.edu.gov.pt;servicos@aegcc.edu.gov.pt,238310160;238310167,35496.2085537827,82678.9647426458
14017,160076,600081826,Agrupamento de Escolas de Meda,Agrupada,Avenida Gago Coutinho e Sacadura Cabral,MEDA,Meda,Guarda,346354,Centro,QZP.31,Publico,2,279882728,http://www.agrupamentoescolasmeda.pt,direcao@aemeda.edu.gov.pt;servicos@aemeda.edu.gov.pt,279880010;279880011,73338.6193372945,145220.79836117
14018,160258,600078914,Agrupamento de Escolas de Manteigas,Agrupada,Rua de S. Lourenço,MANTEIGAS,Manteigas,Guarda,342063,Centro,QZP.34,Publico,2,275980049,http://eb23manteigas.webnode.com.pt/,direcao@aemanteigas.edu.gov.pt;servicos@aemanteigas.edu.gov.pt,275980040;275980041,50523.9733688679,81856.9729641702
14019,160702,600074471,"Agrupamento de Escolas A Lã e a Neve, Covilhã",Agrupada,"Rua das Escolas, Cantar Galo, Bairro de S. Domingos",COVILHÃ,Covilhã,Castelo Branco,330115,Centro,QZP.34,Publico,6,275319523,http://www.aelaneve.pt/,direcao@aealaneve.edu.gov.pt;servicos@aealaneve.edu.gov.pt,275319520;275319521,54235.3154764459,70003.0462823507
14020,160714,600073378,Agrupamento de Escolas de Figueira de Castelo Rodrigo,Agrupada,"Avenida Heróis de Castelo Rodrigo, 60",FIGUEIRA CASTELO RODRIGO,Figueira de Castelo Rodrigo,Guarda,403714,Centro,QZP.31,Publico,5,271311810,http://www.aefcr.pt/moodle/,direcao@aefcr.edu.gov.pt;servicos@aefcr.edu.gov.pt,271311156,98685.2331438766,136601.185640473
14021,160842,600076938,Agrupamento de Escolas de Fornos de Algodres,Agrupada,Estrada Nacional nº 16,FORNOS DE ALGODRES,Fornos de Algodres,Guarda,346366,Centro,QZP.32,Publico,4,271700118,,direcao@ae-fa.edu.gov.pt;servicos@ae-fa.edu.gov.pt,271700110;271703641,49720.0200687539,105327.40897577
14022,160866,600078078,Agrupamento de Escolas de Celorico da Beira,Agrupada,Lg. da Corredoura,CELORICO DA BEIRA,Celorico da Beira,Guarda,346070,Centro,QZP.32,Publico,4,271741300,,direcao@sacaduracabral.edu.gov.pt;servicos@sacaduracabral.edu.gov.pt,271742415;271742075,62414.2844183976,107291.376407946
14023,161100,600074811,"Agrupamento de Escolas Pedro Álvares Cabral, Belmonte",Agrupada,Bairro de Santa Maria,BELMONTE,Belmonte,Castelo Branco,346007,Centro,QZP.34,Publico,3,275910003,,direcao@aepac.edu.gov.pt;servicos@aepac.edu.gov.pt,275910000,66903.4553126547,77367.3543702139
14024,161123,600076474,"Agrupamento de Escolas Gardunha e Xisto, Fundão",Agrupada,Bairro Santa Isabel,FUNDÃO,Fundão,Castelo Branco,345313,Centro,QZP.34,Publico,20,275751909,www.aesg.edu.pt,direcao@aegx.edu.gov.pt;servicos@aegx.edu.gov.pt,275772928;275772558,53446.2205337991,51810.0484607915
14025,161159,600075974,"Agrupamento de Escolas Pêro da Covilhã, Covilhã",Agrupada,Rua Dr Manuel Castro Martins,COVILHÃ,Covilhã,Castelo Branco,310232,Centro,QZP.34,Publico,11,275320061,https://sites.google.com/site/agperodacovilha,direcao@aecovilha.edu.gov.pt;servicos@aecovilha.edu.gov.pt,275320060;275320066,53741.0051251899,67528.9316540549
14026,161184,600075672,"Agrupamento de Escolas de Teixoso, Covilhã",Agrupada,Qt. de S. João,TEIXOSO,Covilhã,Castelo Branco,345350,Centro,QZP.34,Publico,7,275920158,http://www.aeteixoso.pt/,direcao@aeteixoso.edu.gov.pt;servicos@aeteixoso.edu.gov.pt,275920150,57094.7993868849,72057.915648238
14027,161196,600085511,Agrupamento de Escolas do Fundão,Agrupada,Rua António José Saraiva,FUNDÃO,Fundão,Castelo Branco,403659,Centro,QZP.34,Publico,10,275751040,www.esfundao.pt,direcao@aef.edu.gov.pt;servicos@aef.edu.gov.pt,275750480;275753888,53885.9426760477,52513.7291496591
14028,162012,600086100,"Agrupamento de Escolas da Sé, Guarda",Agrupada,R. Almeida Garrett,GUARDA,Guarda,Guarda,402886,Centro,QZP.33,Publico,18,271211592,http://aese.edu.pt,direcao@aeseguarda.edu.gov.pt;servicos@aeseguarda.edu.gov.pt,271227004,73861.1061760889,96520.8468385641
14029,162036,600077225,"Agrupamento de Escolas Frei Heitor Pinto, Covilhã",Agrupada,Avenida 25 de Abril,COVILHÃ,Covilhã,Castelo Branco,401821,Centro,QZP.34,Publico,15,275331249,www.aefhp.pt,direcao@aefhp.edu.gov.pt;servicos@aefhp.edu.gov.pt,275331228;275951395,53827.2410606817,67959.1868183729
14030,172418,600084019,"Agrupamento de Escolas Poeta Joaquim Serra, Montijo",Agrupada,Alameda Doutor José Afonso Manuel dos Santos,MONTIJO,Montijo,Setúbal,402539,Lisboa e Vale do Tejo,QZP.46,Publico,11,212322364,http://agrup.espjs.edu.pt/,direcao@aepjs.edu.gov.pt;servicos@aepjs.edu.gov.pt,212326670;212326680,-71227.0442809552,-106966.249323412
14031,172420,600084060,"Agrupamento de Escolas Eça de Queirós, Lisboa",Agrupada,Rua Cidade de Benguela,LISBOA,Lisboa,Lisboa,401663,Lisboa e Vale do Tejo,QZP.45,Publico,3,218540713,www.queiroz.pt,agrupamento@queiroz.pt;direcao@aeeq.edu.gov.pt;servicos@aeeq.edu.gov.pt,218540710;218540717,-85095.8315746236,-99751.7773654426
14032,172431,600084400,"Agrupamento de Escolas D. João V, Amadora",Agrupada,R. Mª Lamas,AMADORA,Amadora,Lisboa,401328,Lisboa e Vale do Tejo,QZP.45,Publico,2,214970152,http://www.aedjv.pt,direcao@aedjoaov.edu.gov.pt;servicos@aedjoaov.edu.gov.pt,214906460;214906547,-94143.5812355014,-102280.871790104
14033,172443,600085031,"Agrupamento de Escolas da Cidadela, Cascais",Agrupada,R. Dr.Fernando Batista M.F.Batista Viegas,CASCAIS,Cascais,Lisboa,401201,Lisboa e Vale do Tejo,QZP.45,Publico,5,214820920,,direcao@cidadela.edu.gov.pt;servicos@cidadela.edu.gov.pt,214864080;214836121,-112711.434837734,-106467.238874388
14034,172455,600085252,"Agrupamento de Escolas Monte da Lua, Sintra",Agrupada,R. Pedro de Cintra,SINTRA,Sintra,Lisboa,400415,Lisboa e Vale do Tejo,QZP.45,Publico,11,219231164,agml.pt,direcao@agml.edu.gov.pt;servicos@agml.edu.gov.pt,219231880;219106271,-108179.493454079,-95682.3943553342
14035,172467,600085287,"Agrupamento de Escolas D. Maria II, Sintra",Agrupada,Rua da Esperança,AGUALVA-CACÉM,Sintra,Lisboa,401833,Lisboa e Vale do Tejo,QZP.45,Publico,5,219129175,www.esgamabarros.pt/,direcao@aedmaria2-sintra.edu.gov.pt;servicos@aedmaria2-sintra.edu.gov.pt,219129170;219129172,-102656.256820382,-98928.4202757453
14036,171219,600074927,"Agrupamento de Escolas Aqua Alba, Agualva, Sintra",Agrupada,"Rua António Nunes Sequeira, nº 1",AGUALVA-CACÉM,Sintra,Lisboa,401754,Lisboa e Vale do Tejo,QZP.45,Publico,7,219130224,www.agrupamentoantoniosergio.pt,direcao@aeaquaalba.edu.gov.pt;servicos@aeaquaalba.edu.gov.pt,219 129 330,-101352.204375173,-99034.7559044159
14037,171580,600079716,"Agrupamento de Escolas Lapiás, Sintra",Agrupada,R. Arq. José Luís Monteiro,MONTELAVAR,Sintra,Lisboa,341307,Lisboa e Vale do Tejo,QZP.45,Publico,16,219271326,,direcao@aelapias.edu.gov.pt;servicos@aelapias.edu.gov.pt,219271325,-103729.839067941,-88648.0800781566
14038,171591,600079295,"Agrupamento de Escolas do Algueirão, Sintra",Agrupada,"R. Dr. Coutinho Pais, 14 / 16",MEM MARTINS,Sintra,Lisboa,342191,Lisboa e Vale do Tejo,QZP.45,Publico,3,219209430,www.emds.edu.pt,direcao@aea.edu.gov.pt;servicos@aea.edu.gov.pt,219225150;219225155,-105763.871865457,-95509.9558063352
14039,171608,600079228,"Agrupamento de Escolas Agualva Mira Sintra, Sintra",Agrupada,Avenida dos Bombeiros Voluntários,AGUALVA-CACÉM,Sintra,Lisboa,402199,Lisboa e Vale do Tejo,QZP.45,Publico,8,210120029,www.aeams.pt,direcao@aeams.edu.gov.pt;servicos@aeams.edu.gov.pt,214338380;219148049,-101238.206407798,-98069.2114918874
14040,171669,600080021,"Agrupamento de Escolas da Damaia, Amadora",Agrupada,R. Bernardino Machado,AMADORA,Amadora,Lisboa,310220,Lisboa e Vale do Tejo,QZP.45,Publico,5,214971113,,direcao@aedamaia.edu.gov.pt;servicos@aedamaia.edu.gov.pt,214906370;214901424,-94466.2761273384,-102222.421120053
14041,171670,600079333,Agrupamento de Escolas do Montijo,Agrupada,Rua Mártires do Tarrafal,MONTIJO,Montijo,Setúbal,310438,Lisboa e Vale do Tejo,QZP.46,Publico,6,212317239,www.aemontijo.pt,direcao@aemontijo.edu.gov.pt;servicos@aemontijo.edu.gov.pt,212326160;212326162,-74137.5522496747,-105907.979685298
14042,171682,600079937,"Agrupamento de Escolas Piscinas - Olivais, Lisboa",Agrupada,Rua Capitão Santiago de Carvalho,LISBOA,Lisboa,Lisboa,346706,Lisboa e Vale do Tejo,QZP.45,Publico,4,218538384,www.agpiscinasolivais.com,direcao@aepiscinasolivais.edu.gov.pt;servicos@aepiscinasolivais.edu.gov.pt,218517080;218515939,-84922.1369957861,-99169.5974974763
14043,171700,600085260,"Agrupamento de Escolas das Laranjeiras, Lisboa",Agrupada,"Estrada das Laranjeiras, 122",LISBOA,Lisboa,Lisboa,400117,Lisboa e Vale do Tejo,QZP.45,Publico,5,217220731,,direcao@aelaranjeiras.edu.gov.pt;servicos@aelaranjeiras.edu.gov.pt,217246060,-89472.5029757653,-102330.867850546
14044,171712,600079775,"Agrupamento de Escolas de Santa Maria dos Olivais, Lisboa",Agrupada,Avenida Dr. Francisco Luis Gomes,LISBOA,Lisboa,Lisboa,400397,Lisboa e Vale do Tejo,QZP.45,Publico,5,218534193,www.aeolivais.pt,direcao@aesmolivais.edu.gov.pt;servicos@aesmolivais.edu.gov.pt,218536433;218531433,-84732.2485680378,-99237.35153353
14045,171724,600079627,"Agrupamento de Escolas Manuel da Maia, Lisboa",Agrupada,"R. Freitas Gazul, 6",LISBOA,Lisboa,Lisboa,342075,Lisboa e Vale do Tejo,QZP.45,Publico,3,213955606,,direcao@agescolasmanuelmaia.edu.gov.pt;servicos@agescolasmanuelmaia.edu.gov.pt,213928870;213928871,-90200.2899368274,-105000.662172376
14046,171736,600079953,"Agrupamento de Escolas do Alto do Lumiar, Lisboa",Agrupada,Azinhaga da Musgueira,LISBOA,Lisboa,Lisboa,346690,Lisboa e Vale do Tejo,QZP.45,Publico,5,217560932,,direcao@aealto-lumiar.edu.gov.pt;servicos@aealto-lumiar.edu.gov.pt,217571510;217570527,-88759.1296173983,-98669.0286376498
14047,171748,600078469,"Agrupamento de Escolas Rainha D. Leonor, Lisboa",Agrupada,R. Maria Amália Vaz de Carvalho,LISBOA,Lisboa,Lisboa,402631,Lisboa e Vale do Tejo,QZP.45,Publico,6,218470948,www.aerdl.eu,direcao@aerainhadleonor.edu.gov.pt;servicos@aerainhadleonor.edu.gov.pt,218428880;218499668,-87624.3461010644,-101316.427922295
14048,170902,600075010,"Agrupamento de Escolas da Baixa da Banheira, Vale da Amoreira, Moita",Agrupada,Praceta Maria Helena Vieira da Silva,VALE DA AMOREIRA,Moita,Setúbal,403234,Lisboa e Vale do Tejo,QZP.46,Publico,4,212025699,http://esbb.pt/,direcao@aebbva.edu.gov.pt;servicos@aebbva.edu.gov.pt,212099970,-79042.8100103072,-113163.27768389
14049,171750,600080170,"Agrupamento de Escolas Luís de Camões, Lisboa",Agrupada,"Avenida Padre Manuel da Nóbrega, 15",LISBOA,Lisboa,Lisboa,342038,Lisboa e Vale do Tejo,QZP.45,Publico,2,218429543,http://aeluisdecamoes.wix.com/home,direcao@aeluisdecamoes.edu.gov.pt;servicos@aeluisdecamoes.edu.gov.pt,218429540;218429541,-87128.1902345452,-102080.862076065
14050,171761,600079821,"Agrupamento de Escolas de Alvalade, Lisboa",Agrupada,Rua Marquês de Soveral,LISBOA,Lisboa,Lisboa,404433,Lisboa e Vale do Tejo,QZP.45,Publico,4,218477143,http://aealvalade.edupt/,direcao@aealvalade.edu.gov.pt;servicos@aealvalade.edu.gov.pt,218484111;218420013,-87137.0850737887,-100590.772002713
14051,171773,600085244,"Agrupamento de Escolas de Benfica, Lisboa",Agrupada,R. Prof. José Sebastião e Silva,LISBOA,Lisboa,Lisboa,401973,Lisboa e Vale do Tejo,QZP.45,Publico,5,217121475,https://sites.google.com/a/aebenfica.pt/aebenfica/,direcao@aebenfica.edu.gov.pt;servicos@aebenfica.edu.gov.pt,217121470;217168007,-92237.2039482758,-101690.864730897
14052,171785,600079368,"Agrupamento de Escolas Quinta de Marrocos, Lisboa",Agrupada,"Estrada de Benfica, 549",LISBOA,Lisboa,Lisboa,342890,Lisboa e Vale do Tejo,QZP.45,Publico,3,217161610,,direcao@aeqmarrocos.edu.gov.pt;servicos@aeqmarrocos.edu.gov.pt,217112330;217112331,-92376.2857587015,-101493.061651346
14053,171797,600079546,"Agrupamento de Escolas Pintor Almada Negreiros, Lisboa",Agrupada,Rua Vasco da Gama Fernandes,LISBOA,Lisboa,Lisboa,342646,Lisboa e Vale do Tejo,QZP.45,Publico,2,217567195,eb23pan.webnode.pt/,direcao@aeanegreiros.edu.gov.pt;servicos@aeanegreiros.edu.gov.pt,217567190;217567191,-87870.9488194398,-98377.2312195961
14054,171803,600080161,"Agrupamento de Escolas de Carnaxide - Portela, Oeiras",Agrupada,Rua Pedro Homem de Melo,CARNAXIDE,Oeiras,Lisboa,330140,Lisboa e Vale do Tejo,QZP.45,Publico,3,214173040,,direcao@aecarnaxide-portela.edu.gov.pt;servicos@aecarnaxide-portela.edu.gov.pt,214241610;214241617,-94866.198579974,-104690.758370447
14055,171815,600079660,"Agrupamento de Escolas de Miraflores, Oeiras",Agrupada,Avenida General Norton de Matos,ALGÉS,Oeiras,Lisboa,402242,Lisboa e Vale do Tejo,QZP.45,Publico,4,214123549,,direcao@aemiraflores.edu.gov.pt;servicos@aemiraflores.edu.gov.pt,214123540;214102552,-95055.9615669083,-105890.954054455
14056,171827,600079554,"Agrupamento de Escolas de Paço de Arcos, Oeiras",Agrupada,R. Carlos Vieira Ramos,PAÇO DE ARCOS,Oeiras,Lisboa,402072,Lisboa e Vale do Tejo,QZP.45,Publico,5,214427439,http://www.aepa.pt,direcao@aepa.edu.gov.pt;servicos@aepa.edu.gov.pt,214425049;214417930,-101323.892472432,-106962.793705448
14057,171839,600079155,"Agrupamento de Escolas Miradouro de Alfazina, Almada",Agrupada,Rua do Miradouro de Alfazina,CAPARICA,Almada,Setúbal,330814,Lisboa e Vale do Tejo,QZP.46,Publico,2,212945513,www.miradouroalfazina.com,direcao@miradouroalfazina.edu.gov.pt;servicos@miradouroalfazina.edu.gov.pt,212945510;212945511,-91899.7745841774,-109853.171887628
14058,171840,600079449,"Agrupamento de Escolas Vasco Santana, Odivelas",Agrupada,Rua 25 de Agosto - Bons Dias,ODIVELAS,Odivelas,Lisboa,344620,Lisboa e Vale do Tejo,QZP.45,Publico,7,219347673,http://aevs.edu.ciencias.ulisboa.pt/,direcao@agevascosantana.edu.gov.pt;servicos@agevascosantana.edu.gov.pt,219347670;219347671,-91255.4280210054,-95560.3329661461
14059,171852,600079473,"Agrupamento de Escolas de Moinhos da Arroja, Odivelas",Agrupada,Rua Fernando Lopes Graça,ODIVELAS,Odivelas,Lisboa,341770,Lisboa e Vale do Tejo,QZP.45,Publico,4,219348853,,direcao@aemoinhosarroja.edu.gov.pt;servicos@aemoinhosarroja.edu.gov.pt,219348850,-91967.7994368451,-96007.3522448213
14060,171864,600080226,"Agrupamento de Escolas do Forte da Casa, Vila Franca de Xira",Agrupada,R. da República,FORTE DA CASA,Vila Franca de Xira,Lisboa,400191,Lisboa e Vale do Tejo,QZP.45,Publico,3,219568839,oficial@aefc.edu.p,direcao@aefc.edu.gov.pt;servicos@aefc.edu.gov.pt,219568830,-80268.2685254439,-87577.58167349
